{
  "format": "scratch-ai-bridge/canonical-ir",
  "version": 1,
  "name": "synthetic-repeat-loop",
  "stage": {
    "kind": "stage",
    "name": "Stage",
    "variables": [],
    "lists": [],
    "costumes": [{ "name": "platform-day", "dataFormat": "svg" }],
    "sounds": [],
    "scripts": [],
    "procedures": []
  },
  "sprites": [
    {
      "kind": "sprite",
      "name": "Sample sprite",
      "variables": [],
      "lists": [],
      "costumes": [{ "name": "generic-character", "dataFormat": "svg" }],
      "sounds": [],
      "scripts": [
        {
          "blocks": [
            { "opcode": "event_whenflagclicked", "inputs": {}, "fields": {} },
            {
              "opcode": "control_repeat",
              "inputs": {
                "TIMES": { "type": "literal", "value": 3 },
                "SUBSTACK": {
                  "type": "stack",
                  "blocks": [
                    {
                      "opcode": "motion_movesteps",
                      "inputs": { "STEPS": { "type": "literal", "value": 10 } },
                      "fields": {}
                    }
                  ]
                }
              },
              "fields": {}
            }
          ]
        }
      ],
      "procedures": [],
      "x": 0,
      "y": 0,
      "direction": 90,
      "size": 100,
      "visible": true,
      "draggable": false,
      "rotationStyle": "all around"
    }
  ],
  "broadcasts": []
}
