{
  "format": "scratch-ai-bridge/canonical-ir",
  "version": 1,
  "name": "Platformer Core Controls",
  "stage": {
    "kind": "stage",
    "name": "Stage",
    "variables": [],
    "lists": [],
    "costumes": [],
    "sounds": [],
    "scripts": [],
    "procedures": []
  },
  "sprites": [
    {
      "kind": "sprite",
      "name": "Player",
      "variables": [{ "name": "y velocity", "value": 0 }],
      "lists": [],
      "costumes": [
        {
          "name": "player",
          "dataFormat": "svg",
          "data": "<svg xmlns=\"http://www.w3.org/2000/svg\" width=\"36\" height=\"48\"><rect x=\"1\" y=\"1\" width=\"34\" height=\"46\" rx=\"7\" fill=\"#4c97ff\" stroke=\"#2457a6\" stroke-width=\"2\"/><circle cx=\"12\" cy=\"17\" r=\"3\" fill=\"white\"/><circle cx=\"24\" cy=\"17\" r=\"3\" fill=\"white\"/></svg>",
          "rotationCenterX": 18,
          "rotationCenterY": 24
        }
      ],
      "sounds": [],
      "scripts": [
        {
          "blocks": [
            { "opcode": "event_whenflagclicked" },
            {
              "opcode": "looks_switchcostumeto",
              "inputs": { "COSTUME": { "type": "literal", "value": "player" } }
            },
            {
              "opcode": "data_setvariableto",
              "fields": { "VARIABLE": "y velocity" },
              "inputs": { "VALUE": { "type": "literal", "value": 0 } }
            },
            {
              "opcode": "control_forever",
              "inputs": {
                "SUBSTACK": {
                  "type": "stack",
                  "blocks": [
                    {
                      "opcode": "motion_changeyby",
                      "inputs": { "DY": { "type": "variable", "name": "y velocity" } }
                    },
                    {
                      "opcode": "data_changevariableby",
                      "fields": { "VARIABLE": "y velocity" },
                      "inputs": { "VALUE": { "type": "literal", "value": -1 } }
                    },
                    {
                      "opcode": "control_if",
                      "inputs": {
                        "CONDITION": {
                          "type": "block",
                          "block": {
                            "opcode": "sensing_touchingobject",
                            "inputs": {
                              "TOUCHINGOBJECTMENU": { "type": "literal", "value": "Platform" }
                            }
                          }
                        },
                        "SUBSTACK": {
                          "type": "stack",
                          "blocks": [
                            {
                              "opcode": "motion_changeyby",
                              "inputs": { "DY": { "type": "literal", "value": 1 } }
                            },
                            {
                              "opcode": "data_setvariableto",
                              "fields": { "VARIABLE": "y velocity" },
                              "inputs": { "VALUE": { "type": "literal", "value": 0 } }
                            }
                          ]
                        }
                      }
                    },
                    {
                      "opcode": "control_wait",
                      "inputs": { "DURATION": { "type": "literal", "value": 0.03 } }
                    }
                  ]
                }
              }
            }
          ]
        },
        {
          "blocks": [
            { "opcode": "event_whenkeypressed", "fields": { "KEY_OPTION": "right arrow" } },
            {
              "opcode": "motion_changexby",
              "inputs": { "DX": { "type": "literal", "value": 8 } }
            }
          ]
        },
        {
          "blocks": [
            { "opcode": "event_whenkeypressed", "fields": { "KEY_OPTION": "left arrow" } },
            {
              "opcode": "motion_changexby",
              "inputs": { "DX": { "type": "literal", "value": -8 } }
            }
          ]
        },
        {
          "blocks": [
            { "opcode": "event_whenkeypressed", "fields": { "KEY_OPTION": "up arrow" } },
            {
              "opcode": "control_if",
              "inputs": {
                "CONDITION": {
                  "type": "block",
                  "block": {
                    "opcode": "sensing_touchingobject",
                    "inputs": { "TOUCHINGOBJECTMENU": { "type": "literal", "value": "Platform" } }
                  }
                },
                "SUBSTACK": {
                  "type": "stack",
                  "blocks": [
                    {
                      "opcode": "data_setvariableto",
                      "fields": { "VARIABLE": "y velocity" },
                      "inputs": { "VALUE": { "type": "literal", "value": 12 } }
                    }
                  ]
                }
              }
            }
          ]
        }
      ],
      "procedures": [],
      "x": -100,
      "y": -80,
      "direction": 90,
      "size": 100,
      "visible": true,
      "draggable": false,
      "rotationStyle": "left-right"
    },
    {
      "kind": "sprite",
      "name": "Platform",
      "variables": [],
      "lists": [],
      "costumes": [
        {
          "name": "platform",
          "dataFormat": "svg",
          "data": "<svg xmlns=\"http://www.w3.org/2000/svg\" width=\"300\" height=\"32\"><rect x=\"1\" y=\"1\" width=\"298\" height=\"30\" rx=\"6\" fill=\"#59c059\" stroke=\"#2f7d32\" stroke-width=\"2\"/></svg>",
          "rotationCenterX": 150,
          "rotationCenterY": 16
        }
      ],
      "sounds": [],
      "scripts": [],
      "procedures": [],
      "x": 0,
      "y": -130,
      "direction": 90,
      "size": 100,
      "visible": true,
      "draggable": false,
      "rotationStyle": "don't rotate"
    }
  ],
  "broadcasts": []
}
