{
  "format": "scratch-ai-bridge/canonical-ir",
  "version": 1,
  "name": "Move and Say",
  "stage": {
    "kind": "stage",
    "name": "Stage",
    "variables": [
      {
        "name": "score",
        "value": 0
      }
    ],
    "lists": [],
    "costumes": [],
    "sounds": [],
    "scripts": [],
    "procedures": []
  },
  "sprites": [
    {
      "kind": "sprite",
      "name": "Sprite1",
      "x": 0,
      "y": 0,
      "direction": 90,
      "size": 100,
      "visible": true,
      "draggable": false,
      "rotationStyle": "all around",
      "variables": [],
      "lists": [],
      "costumes": [],
      "sounds": [],
      "procedures": [],
      "scripts": [
        {
          "position": {
            "x": 60,
            "y": 60
          },
          "blocks": [
            {
              "opcode": "event_whenflagclicked"
            },
            {
              "opcode": "data_setvariableto",
              "fields": {
                "VARIABLE": "score"
              },
              "inputs": {
                "VALUE": {
                  "type": "literal",
                  "value": 0
                }
              }
            },
            {
              "opcode": "control_repeat",
              "inputs": {
                "TIMES": {
                  "type": "literal",
                  "value": 10
                },
                "SUBSTACK": {
                  "type": "stack",
                  "blocks": [
                    {
                      "opcode": "motion_movesteps",
                      "inputs": {
                        "STEPS": {
                          "type": "literal",
                          "value": 10
                        }
                      }
                    },
                    {
                      "opcode": "data_changevariableby",
                      "fields": {
                        "VARIABLE": "score"
                      },
                      "inputs": {
                        "VALUE": {
                          "type": "literal",
                          "value": 1
                        }
                      }
                    },
                    {
                      "opcode": "control_wait",
                      "inputs": {
                        "DURATION": {
                          "type": "literal",
                          "value": 0.1
                        }
                      }
                    }
                  ]
                }
              }
            },
            {
              "opcode": "looks_say",
              "inputs": {
                "MESSAGE": {
                  "type": "literal",
                  "value": "完成！"
                }
              }
            }
          ]
        }
      ]
    }
  ],
  "broadcasts": []
}